{
  "artifacts": [
    "experiments/aid4run/PREREGISTRATION.md",
    "results/aid4-v1/result.json",
    "results/aid4-v1/canonical-manifest.json"
  ],
  "authorityEffect": "none",
  "id": "AID-4-V1",
  "independenceClaims": [],
  "manifest": {
    "commit": "c1d5860f7d8af9164a2d2af761c5ad14188918d1",
    "path": "results/aid4-v1/canonical-manifest.json",
    "sha256": "c0534eb85dfa099e71bdfd0802da9eb9361c9415d9a135c2cc041dd246ac3890"
  },
  "origin": {
    "controlRelationship": "same-control-domain",
    "mode": "repository-native",
    "sourceCommit": null,
    "sourceRepository": null
  },
  "protocol": {
    "commit": "535f77d4ba1480b08793765a48442b6686d68b54",
    "path": "experiments/aid4run/PREREGISTRATION.md",
    "sha256": "821c3bf104d25af5e6205ff5df439d2e29d2086b7a85d929ede5aa2323af5f99"
  },
  "result": {
    "commit": "c1d5860f7d8af9164a2d2af761c5ad14188918d1",
    "path": "results/aid4-v1/result.json",
    "sha256": "52986a906a84b4add8ffc57fec54a1c903e5710c02000358466cd6fbdb807b86"
  },
  "schema": "minority-prophet.research-record.v1",
  "stage": "canonical",
  "verdict": "rejected"
}
