{
  "artifacts": [
    "experiments/dri2/PREREGISTRATION.md"
  ],
  "authorityEffect": "none",
  "id": "DRI-2-V1",
  "independenceClaims": [],
  "manifest": null,
  "origin": {
    "controlRelationship": "same-control-domain",
    "mode": "repository-native",
    "sourceCommit": null,
    "sourceRepository": null
  },
  "protocol": {
    "commit": "574a6a626845215244f03fa85a5cd689f0ed350c",
    "path": "experiments/dri2/PREREGISTRATION.md",
    "sha256": "8d05327d3505d943aa7947aacefcd656be0d59be5f6b1d881d8ec2fc0cc2a94e"
  },
  "result": null,
  "schema": "minority-prophet.research-record.v1",
  "stage": "candidate",
  "verdict": null
}
